{"authority":"BOUNDED_EXERCISED_PHASE2_CONFIGURED_POINT_COMPLETENESS_METRICS_AND_EXACT_BACKEND_QUALIFICATION_ONLY_NOT_TRUSTED_SENTRY_RUNTIME_HOST_HYPERVISOR_HARDWARE_ATTESTATION_PHASE3_EDR_ADMISSION_OR_PUBLIC_RELEASE_AUTHORITY","backend":{"canary_lock_digest":"sha256:3144482d122296b3c95285a9a47786510c522d50fe8b99582988e6b19b820142","implementation_digest":"sha256:de00094c19f8d00dee11d4be24f273c7925769587e7ae9cd02c2f1d24e20a453","lock_digest":"sha256:0d9c1f32f019ec3d9c8b9cfd182385ffed84f0e70e84543abbad0bea4bda288e","receipt_digest":"sha256:b95fb334eef6a8d8e9c084fb833b93cda0f5dd52cdf4decaae5ce41fa02ecfde","runs":3,"runtime_lock_digest":"sha256:f56bfc3e06e26e682c609d51811edf341d3f688b67f13104883265f515efe602","status":"PASS","unique_container_ids":3,"unique_run_ids":3},"capture":{"architecture":"arm64","canary_lock_digest":"sha256:3144482d122296b3c95285a9a47786510c522d50fe8b99582988e6b19b820142","cells":100,"complete_cells":100,"frame_count":7220,"matrix_bindings_digest":"sha256:0af951e1900351a585c0d7b0e76dba27ab3f358e6cfc47fda5235f4b9d7ca9d8","monitor_implementation_digest":"sha256:3b2224766c62927a8d1ea349687a653917f3c1ea91adaaeffed62580bd93181d","observed_point_counts":{"container/start":100,"sentry/clone":100,"sentry/task_exit":300,"syscall/execve/enter":200,"syscall/execve/exit":200,"syscall/openat/enter":2980,"syscall/openat/exit":2980,"syscall/write/enter":180,"syscall/write/exit":180},"profile":"pinned-gvisor-remote-v1-configured-point-protobuf/v1","raw_frame_bytes":1029676,"required_points":["container/start","sentry/clone","sentry/task_exit","syscall/execve/enter","syscall/execve/exit","syscall/openat/enter","syscall/openat/exit","syscall/write/enter","syscall/write/exit"],"runtime_lock_digest":"sha256:f56bfc3e06e26e682c609d51811edf341d3f688b67f13104883265f515efe602","runtime_source_commit":"9f3e9a3fba9416ea1f5832d82923d95830479096","session_config_digest":"sha256:58fef34654be7153df60d35ed243b0be685005ca8fd3de308de6eda3d6572bb3","status":"PASS","unique_remote_receipts":100},"decision":{"phase2_exit_eligible":true,"phase3_edr_claim_eligible":false,"phase3_engineering_eligible":true,"public_release_eligible":false,"reason_codes":[],"status":"PASS"},"gate_implementation_digest":"sha256:1c47d2fc62332152dfad337a4288e53ccc945023bc5028ca78b0835328af56fb","limitations":["CONFIGURED_POINTS_ONLY_NOT_UNIVERSAL_EVENT_COMPLETENESS","SENTRY_AND_DOCKER_EVIDENCE_ARE_NOT_TRUSTED_ATTESTATION","ZERO_REPORTED_DROPS_DOES_NOT_PROVE_ABSENCE_OF_UNREPORTED_EVENTS","OPERATOR_AUTHORED_HELD_OUT_MATRIX_IS_NOT_INDEPENDENT_EFFICACY_EVIDENCE","NO_PHASE3_RUNTIME_PREVENTION_OR_EDR_AUTHORITY","NO_ADMISSION_INSTALLER_OR_PUBLIC_RELEASE_AUTHORITY"],"metrics":{"candidate":{"config_digest":"sha256:ae083ce931e8a790929a5bdb55e509a6d63104d293b194ca14d4b2876c2b1bfa","implementation_digest":"sha256:0f6886f271a5df97951ebac59cd54206f06c6231292f82cd39db8c7a6648567a","name":"aragorn","version":"0.3.0-phase2"},"coverage_lock_digest":"sha256:412586185bf454fe8d5524e50903e624fee6cafe92197712559329288e31dba5","outcomes_digest":"sha256:901d2aaaa92ffdfcb3405b93c053fc80e69df1e21d785c92470bcce77453addb","report_digest":"sha256:a10063c6e0066672681d96d149bce914b3fb7a8258a5aa68ae20ecc609c92931","scenario_schedule":["primary","alternate","primary","alternate","primary"],"status":"PASS","suite_digest":"sha256:9305e2d446e5146bd284ba32a6e78bcd2993cc646b5fae6fd1bf55966c0a80f0"},"schema":"aragorn/phase2-exit-gate-report/v1","scope":"bounded-exercised-phase2/v1"}
